{
  "schemaVersion": "1.1",
  "updatedAt": "2026-10-15T13:50:17Z",
  "repos": {
    "web": {
      "repo": "web",
      "repoName": "retech-us/retech-web-automation",
      "framework": "Web \u00b7 TestNG + Selenium",
      "aiEnabled": null,
      "aiCapable": true,
      "finishedAt": "2026-10-15T07:15:51Z",
      "ciRunUrl": "https://github.com/retech-us/retech-web-automation/actions/runs/38676605851",
      "reportUrl": "https://retech-us.github.io/retech-web-automation/",
      "status": "live",
      "source": "allure-pages-json",
      "runId": "38676605851",
      "summary": {
        "llmInvocations": 489.0,
        "healsSucceeded": 168.0,
        "healsFailed": 918.0,
        "healsSkipped": 0,
        "healSuccessRatePct": 15.5,
        "elementInteractions": 3245.0,
        "estimatedCostUsd": 0,
        "estimatedMinutesSaved": 0,
        "avgAiLatencyMs": 464.1,
        "learnedLocatorsCount": 0,
        "flakyQuarantineCount": 0
      },
      "jobs": [
        {
          "name": "scan-tests",
          "status": "completed",
          "metrics": {
            "llmInvocations": 299.0,
            "healsSucceeded": 122.0,
            "healsFailed": 551.0,
            "healsSkipped": 0,
            "healSuccessRatePct": 18.12778603268945,
            "elementInteractions": 2185.0,
            "estimatedCostUsd": 0,
            "estimatedMinutesSaved": 0,
            "avgAiLatencyMs": 598.0969899665552,
            "learnedLocatorsCount": 0,
            "flakyQuarantineCount": 0
          }
        },
        {
          "name": "sequential-only-tests",
          "status": "completed",
          "metrics": {
            "llmInvocations": 14.0,
            "healsSucceeded": 10.0,
            "healsFailed": 29.0,
            "healsSkipped": 0,
            "healSuccessRatePct": 25.641025641025642,
            "elementInteractions": 449.0,
            "estimatedCostUsd": 0,
            "estimatedMinutesSaved": 0,
            "avgAiLatencyMs": 192.42857142857142,
            "learnedLocatorsCount": 0,
            "flakyQuarantineCount": 0
          }
        },
        {
          "name": "hybrid-tests",
          "status": "completed",
          "metrics": {
            "llmInvocations": 175.0,
            "healsSucceeded": 35.0,
            "healsFailed": 337.0,
            "healsSkipped": 0,
            "healSuccessRatePct": 9.408602150537634,
            "elementInteractions": 593.0,
            "estimatedCostUsd": 0,
            "estimatedMinutesSaved": 0,
            "avgAiLatencyMs": 255.33714285714285,
            "learnedLocatorsCount": 0,
            "flakyQuarantineCount": 0
          }
        },
        {
          "name": "parallel-tests",
          "status": "completed",
          "metrics": {
            "llmInvocations": 1.0,
            "healsSucceeded": 1.0,
            "healsFailed": 1.0,
            "healsSkipped": 0,
            "healSuccessRatePct": 50.0,
            "elementInteractions": 18.0,
            "estimatedCostUsd": 0,
            "estimatedMinutesSaved": 0,
            "avgAiLatencyMs": 749.0,
            "learnedLocatorsCount": 0,
            "flakyQuarantineCount": 0
          }
        }
      ],
      "topFailingLocators": {
        "SpatialReviewRealogramPageObject:SpatialReviewRealogramPageObject:Realogram burger icon heal candidate": 107,
        "SpatialReviewRealogramPageObject:Realogram burger icon heal candidate": 107,
        "SpatialReviewRealogramPageObject:Realogram control-panel fallback clickable": 42,
        "SpatialReviewRealogramPageObject:SpatialReviewRealogramPageObject:Realogram control-panel fallback clickable": 21,
        "SpatialReviewRealogramPageObject:AI Training Tab": 12,
        "SpatialReviewRealogramPageObject:SpatialReviewRealogramPageObject:AI Training Tab": 12,
        "ScanDetailsPageObject:ScanDetailsPageObject:Finish Button": 11,
        "ScanDetailsPageObject:Finish Button": 11,
        "SpatialReviewRealogramPageObject:Review Button": 9,
        "SpatialReviewRealogramPageObject:SpatialReviewRealogramPageObject:Review Button": 9,
        "ImportsPageObject:ImportsPageObject:Preview Status": 14,
        "ImportsPageObject:Preview Status": 14,
        "FilesTabPageObject:Administration Tab": 1,
        "TasksPageObject:TasksPageObject:ChooseCategoryDropDownButton": 156,
        "TasksPageObject:ChooseCategoryDropDownButton": 156,
        "TasksPageObject:TasksPageObject:Tasks SearchBar": 13,
        "AssociateTabPageObject:AssociateTabPageObject:Associate doSave button": 4,
        "AssociateTabPageObject:Associate doSave button": 4,
        "StorePageObject:StorePageObject:Edit Store Button": 1,
        "StorePageObject:Edit Store Button": 1,
        "StorePageObject:Store Name": 1,
        "StorePageObject:StorePageObject:Store Name": 1,
        "CleansingToolPageObject:CleansingToolPageObject:Preview Button 1": 1,
        "CleansingToolPageObject:Preview Button 1": 1
      },
      "topHealedModules": {
        "SpatialReviewRealogramPageObject": 355,
        "ScanDetailsPageObject": 325,
        "ApprovalAiPageObject": 14,
        "ImportsPageObject": 28,
        "SupplierTabPageObject": 10,
        "FilesTabPageObject": 1,
        "TasksPageObject": 351,
        "StorePageObject": 11,
        "AssociateTabPageObject": 8,
        "TaskGroupsPageObject": 2,
        "CleansingToolPageObject": 3
      },
      "topSkipReasons": {},
      "note": null
    },
    "mobile-ios": {
      "repo": "mobile-ios",
      "repoName": "retech-us/retech-mobile-automation",
      "framework": "Mobile \u00b7 Appium",
      "aiEnabled": null,
      "aiCapable": true,
      "finishedAt": "2026-10-15T04:00:24Z",
      "ciRunUrl": "https://github.com/retech-us/retech-mobile-automation/actions/runs/38654931787",
      "reportUrl": "https://retech-us.github.io/retech-mobile-automation/ios/",
      "status": "live",
      "source": "ci-snapshot",
      "summary": {
        "llmInvocations": 42.0,
        "healsSucceeded": 38.0,
        "healsFailed": 4.0,
        "healsSkipped": 0.0,
        "healSuccessRatePct": 90.5,
        "elementInteractions": 480.0,
        "estimatedCostUsd": 0.084,
        "estimatedMinutesSaved": 12.5,
        "avgAiLatencyMs": 840.0,
        "learnedLocatorsCount": 3,
        "flakyQuarantineCount": 0
      },
      "jobs": [],
      "note": null
    },
    "mobile-android": {
      "repo": "mobile-android",
      "repoName": "retech-us/retech-mobile-automation",
      "framework": "Mobile \u00b7 Appium",
      "aiEnabled": null,
      "aiCapable": true,
      "finishedAt": "2026-10-15T04:00:24Z",
      "ciRunUrl": "https://github.com/retech-us/retech-mobile-automation/actions/runs/38654931787",
      "reportUrl": "https://retech-us.github.io/retech-mobile-automation/android/",
      "status": "live",
      "source": "ci-snapshot",
      "summary": {
        "llmInvocations": 56.0,
        "healsSucceeded": 48.0,
        "healsFailed": 8.0,
        "healsSkipped": 0.0,
        "healSuccessRatePct": 85.7,
        "elementInteractions": 620.0,
        "estimatedCostUsd": 0.112,
        "estimatedMinutesSaved": 18.0,
        "avgAiLatencyMs": 910.0,
        "learnedLocatorsCount": 4,
        "flakyQuarantineCount": 0
      },
      "jobs": [],
      "note": null
    },
    "api": {
      "repo": "api",
      "repoName": "retech-us/retech-api-automation",
      "framework": "API \u00b7 REST Assured",
      "aiEnabled": null,
      "aiCapable": true,
      "finishedAt": "2026-10-14T18:44:18Z",
      "ciRunUrl": "https://github.com/retech-us/retech-api-automation/actions/runs/38617288276",
      "reportUrl": "https://retech-us.github.io/retech-api-automation/",
      "status": "live",
      "source": "ci-snapshot",
      "summary": {
        "llmInvocations": 28.0,
        "healsSucceeded": 28.0,
        "healsFailed": 0.0,
        "healsSkipped": 0.0,
        "healSuccessRatePct": 100.0,
        "elementInteractions": 350.0,
        "estimatedCostUsd": 0.056,
        "estimatedMinutesSaved": 9.0,
        "avgAiLatencyMs": 420.0,
        "learnedLocatorsCount": 2,
        "flakyQuarantineCount": 0
      },
      "jobs": [],
      "note": null
    }
  },
  "totals": {
    "llmInvocations": 615.0,
    "healsSucceeded": 282.0,
    "healsFailed": 930.0,
    "healsSkipped": 0.0,
    "healSuccessRatePct": 23.3,
    "elementInteractions": 4695.0,
    "estimatedCostUsd": 0.252,
    "estimatedMinutesSaved": 39.5,
    "avgAiLatencyMs": 528.4,
    "learnedLocatorsCount": 9.0,
    "flakyQuarantineCount": 0.0,
    "reposReporting": 4,
    "frameworksReporting": 4,
    "frameworksWithAiEnabled": 0
  }
}
